{"protocol":"v12-cross-run-self-audit-v3","draft_sha256":"463aa1c7c5ddfe5ea4370c486d6816cd8aad1c0085f1a7afcf67ede2c4469c5f","baseline_sha256":"b1eaedebdcd79920138f79ffe860cc494a24fdbdc707151d241ca0a6844bb5fe","language":"tr","checked_ayah_refs":["55:0","55:1","55:2","55:3","55:4","55:5","55:6","55:7","55:8","55:9","55:10","55:11","55:12","55:13","55:14","55:15","55:16","55:17","55:18","55:19","55:20","55:21","55:22","55:23","55:24","55:25","55:26","55:27","55:28","55:29","55:30","55:31","55:32","55:33","55:34","55:35","55:36","55:37","55:38","55:39","55:40","55:41","55:42","55:43","55:44","55:45","55:46","55:47","55:48","55:49","55:50","55:51","55:52","55:53","55:54","55:55","55:56","55:57","55:58","55:59","55:60","55:61","55:62","55:63","55:64","55:65","55:66","55:67","55:68","55:69","55:70","55:71","55:72","55:73","55:74","55:75","55:76","55:77","55:78"],"checks":{"target_language_only":true,"baseline_delta_only":true,"activated_and_retrospective_coverage":true,"atomic_findings":true,"fixed_ayah_anchors":true,"valid_grades":true},"completed":true}
